,0
0, I confidently answered all the questions Mainly the questions were asked related with MVC 4
1,What is design patternWhat is the difference between the user control and custom control
2,AngularJSWhat Directives have you used
3,what is ngmodelnot sure for this one Something about scopeSQLwhat do you do when you find that connection is not responding for 1 minCSingleton patternMVCTempData ViewData ViewBagWhy you use ViewBag instead of ViewData what is the differenceEntity Frameworkcode first VS database first approachhow to design sp using code first method
4,AngularJSWhat Directives have you used
5,what is ngmodelnot sure for this one Something about scopeSQLwhat do you do when you find that connection is not responding for 1 minCSingleton patternMVCTempData ViewData ViewBagWhy you use ViewBag instead of ViewData what is the differenceEntity Frameworkcode first VS database first approachhow to design sp using code first method
6,What is a hashtableWhat is the difference between truncate and deleteWhat is a delegateWhat is a left outer joinCan you rollback a truncate commandWhat is public static void
7,What is refactor how it is usedhow to capture requirementsHow to handle performance issuesHow to deal with a bugWhat is tracingSome basic sql design questionWhat is load balancing and how does it applies to EFSome basic programming question sorting that stuffhow to read a key from webconfigeager locking vs pessimistic lockingexplain concurrencyHow to manage a sessionExplain MVCExplain scope rootscope and isolated scopeHow to cope with change in your designMail automation requirementshow does routing works in MVC How do you solve multiple routes with same signature issuesexplain manual binding in angularExplain dependency injection in AngularWhat is a service in AngularHow would you inject a function in angularProbably more if I remember I will add them
8,What is refactor how it is usedhow to capture requirementsHow to handle performance issuesHow to deal with a bugWhat is tracingSome basic sql design questionWhat is load balancing and how does it applies to EFSome basic programming question sorting that stuffhow to read a key from webconfigeager locking vs pessimistic lockingexplain concurrencyHow to manage a sessionExplain MVCExplain scope rootscope and isolated scopeHow to cope with change in your designMail automation requirementshow does routing works in MVC How do you solve multiple routes with same signature issuesexplain manual binding in angularExplain dependency injection in AngularWhat is a service in AngularHow would you inject a function in angularProbably more if I remember I will add them
9,Q what is the differencebetween repeater and grid viewA GridView displays your data source in an HTML table and extends it to allow paging sorting editing etc
10, A repeater is a template control where you specify the html that is used to render each row
11, A gridview can only show your data in a table but a repeater can show your data in any way you want by creating the relevant ItemTemplate
12, for more detailshttpwww
13,html
14,Some SamplesSQL aggregate functions return a single value calculated from values in a column
15,AvgCountFirstLastSQL scalar functions return a single value based on the input value
16,What is an inline and block elementHow do you store data in the clientHow do you execute a SQL command in Web SQLHow do you get the current location of the clientHow do you make a page responsive in CSS without using a framework
17,How would you reverse the order of an arrays elementWhats the port number of SQL Server1433
18,Whats the difference between a local temp table and a global temp tableA local temp table is accessible for one user connected to the database
19, A global temp table is accessible by all connected users
20,How do you declare a local temp table and a global temp tableCREATE TABLE localtemptablename
21, Uses one CREATE TABLE globaltemptablename
22, Uses two How are transactions usedBegin the transaction Commit the transaction if you want to save the changes Rollback the transaction if you want to undo the changes
23,Whats the difference between Truncate and DeleteTRUNCATEremoves all rows from a table but the table structure its columnsconstraints indexes and so on remains
24,You cannot use TRUNCATE TABLE on a tablereferenced by a FOREIGN KEY constraint
25,DELETE removes rows one at a time and records anentry in the transaction log for each deleted row
26,Whats the difference between REST and SOAPREST can use different data formats but SOAP can only use XML
27, REST has to use HTTP but SOAP can use different protocols
28, REST is faster
29,REST uses the HTTP buildin headers with a variety of mediatypes to carry meta information and use the GET POST PUT and DELETE verbs to perform CRUD operations
30, REST uses URI and methods like GET PUT POST DELETE to expose resources
31,How would you save the last time a file in a virtual directory of images was accessed in a tableSomething to do with HTTP HandlerModules
32,MVCWhats a predicateWhy is it called MVStar or MV i dont know instead of MVCWhats the difference between json and partial view I know thats a weird question but it happenedWhat can ajax calls returnCWhats an action Not MVC actionAngularJSHow did you handle exceptionsHow did you interact with the databaseExplain the apply lifecycleHow did you use digestWhats the difference between custom and value types
33,Vendor questionsc1difference between string and string builder2difference between clone and copy3 private  protected and protected internal4 can a private class be inheritedsql interview questions1local table and global temp table2 TransactionsThen he said i think you know stuffs so he stopped and sent me face to face interview request to Windsor
34, The ones I rememberDifference between String and StringBuilderString is immutable which means that every time you assign a new value to a String object the system has to create an entirely new string
35, StringBuilder is a class designed to circumvent this problem
36,Difference between chr and asc I assumed it is a SQL questionCHR or CHAR is a character data type single character while ASC is Ascending used in ordering SQL queries
37, I may have misunderstood the question it came after several SQL related questions
38,How do you link a stylesheet into a webpageltlink hrefwhatever relstylesheetgtDifference between to and to xIm not sure if I understood the interviewer properly
39,What is SSIS and what is it used forSSIS stands for SQL Server Integration Services
40, It is used for hosting and configuring Web Applications on a home server
41,Does Angular use AJAX under the hoodFor the http service Angular uses AJAX
42,What is AJAXAjax is a clientside script that communicates to and from a serverdatabase without needing a postback or page refresh
43,What are the downsides to using stored proceduresModification of a stored procedure from its norm requires writing a new procedure or writing a unique query
44, SQL Server will optimize stored procedures when they are used frequently as well leading to an increase in performance
45,NET MVC Fullstack or partstackASP
46,NET MVC is fullstack which is the idea of having everything you need for a web application in one framework
47, A partstack framework requires an accompanying framework to handle the other sections of the application
48, For example AngularJS being only frontend is partstack
49,What are the default number of columns in a Bootstrap application12
50,Why do you care about the columns in a Bootstrap applicationBootstrap columns are used to format an applications display based on the size of the screen
51,When connecting to a database via LINQ is the data queried immediatelyNo
52,What are AngularJS FiltersAngularJS Filters are customization options that can be set on datasets
53, The filter can simply be a link to a variable field or a function that performs some truefalse result operation
54,What is scopescope is a connection between the view and controller in Angular
55, It is used with Angular expressions to show data in the view
56,What are await and asyncUsed in multithreading a function defined as async is allowed to run outside and independently of the main application thread
57, When await is used within one of these functions it has the async function wait for a period of time
58,IQueryable vs IEnumerable Whats the differences Which executes queries immediatelyIQueryable is an extension of IEnumerable that is built specifically to deal with SQL queries
59, IEnumerable executes queries immediately as it does not make use of SQL features
60,How do you handle events in AngularJSYou use the 
61,on function
62,onclick functionHow do you handle an outside domain connectionNot sure did not answer this question
63, For example in a function within an object the this keyword refers to the object that owns the function
64,How do you check that your Session is valid when conversing between multiple databasesNo idea
65,NETA directive is an HTML helper that is used to provide some sort of function within a page
66,Difference between a table and a viewA table is a set of data within your database
67, A view is a set of data combined from multiple tables or just a single table
68, It does not have to contain all of the data within the tables selected
69,Difference between a stored procedure and a functionA function must return a value while a stored procedure does not have to one of the many differences
70, When the connection is closed or dropped the temporary variable is destroyed
71,Do you use a temp table or a temp variable Which is betterIt depends on the scenario
72, For example in a function you must use a temp table variable
73,JavaScriptvar k  1if 1   evalfunction foo  k  typeof fooWhat would be the value of k
74,multiplication23  6multiplication234  24How would you write the above functions as a single functionvar x  1var output  function  delete x  return x Output of x
75,How is AngularJS different from other JavaScript functionsHow do you create a service in AngularJSWhat is routing in AngularJSHow would you communicate between controllers in AngularJSHow do you manage cookies in AngularJSWhat is a broadcast in AngularJSWhats the difference between scope and scopeOtherWhat is MVCHow did you implement browser compatibilityWhats the difference between HTML5 and HTMLWhats the difference between CSS3 and CSSJavaScriptvar k  1if 1   evalfunction foo  k  typeof fooWhat would be the value of k
76,multiplication23  6multiplication234  24How would you write the above functions as a single functionvar x  1var output  function  delete x  return x Output of x
77,What kind of testing have doneHow did you implement automated testingWhat kind of tools did use for testingHow did you do unit testing What tools did you useWhat kind of tools did use for improving performanceIf theres an application for data entry and the data enterers thats not a word but whatever can only enter 3 pages of data every ten minutes compared to the 10 pages they can enter every ten minutes in another application how would you improve the performance of the applicationWhats the difference between Web API and WCFHow do you version servicesWhat is a dependency injection What are the benefits of dependency injections How do they make testing easierWhat are the benefits of AngularJSHow did you do mocking
78,Where to use Interfaces and Abstract classesUse of using statement in cWhat is Cache and types of cachestate management techniqueWhat are partial classesHow to you analyze the performance of an application which toolswhat is reflectionWhere did you use AJAX call Can we have two AJAX calls on same pageWhy WCF why not web servicesDifference between REST and SOAPHow to increase the performance of the WCF serviceDifference between local temp and global temp tableWhat is sql profilerCan we have two webconfigs in one fileWhat is fault contractHow do you improve a query performaceThere were some questions about my profile and the projects i had done
79,what is fiddlerwhat is Lazy loadingNunitWhat is Wcfhow to write wcfuse of wcfmsmqEntity frameworkdisadvantage of entity framework
80,asax functions4
81, Create function that takes input I Like Cats and return output Cats Like I
82,What is AngularJS Routing6
83,What is WCF
84,How do we create a manual proxy in WCF9
85,What methods are used for AJAX to send request for connecting server side12
86,Action Filters in MVC
87,AngularJs and Web API Questionsfor what purpose you have created Web API how to store dataJSON Data that Web API is returning to the database
88,Have you used Web API or microsoft APIWere you involved in developing Web API SQL Server database in your projectHave you used custom Directives in Angular HowFor EF have you used Database first approach or Code First approachWhat kind of directives we have in BootstrapFrontendHave you used internal CSS or framework for implementing CSS
89,Interview questions on SQL and Object Oriented
90,What is constraintWhat is Referential Integrityjoins in SQLOnetoMany relationship in SQLTransactionWhere we are writing Rollback statement in transactionI have multiple queries in Transaction so is it good idea to write everything in one transaction or maintain one transaction for each
91,What is interface and Abstract classWhat are the things that we can write in interface and abstract classLike methods properties etcWhat is acronym SOLID in object orientedDesign PatternsFactory Singleton etcCan we instantiate interface and abstract classHow many interfaces we can implement using single classIs there any limitHow many abstract class we can inherit using single classvalue type and reference type in OO
92,What is application settings in mvcwhat are 3 layers in chow to you provide security in webservicehow many records you have in your sql server table
93,What is application settings in mvcwhat are 3 layers in chow to you provide security in webservicehow many records you have in your sql server table
94,diff btwn interface and class3
95, query performance in sql4
96,application balancing6
97,WCF and Webservices diff8
98,NET  C and SQLdiff between machine config and web config
99,without transactiondiff between thread and processIs thread is a processwhat is command in ADO
100,NETdiff between data adapter and data readerIf I have the bunch of data in dataset and i want to store it in tablewhole data together then what method i should useHow I will read data from dataset without using loopwhat is auto post backhow to stop controls involving in Auto post backhow to stop client side validation
101,related to API and SQL
102,What is RESTfulWhat are the verbs used in REST APIUnit testingHow have you implemented Unit testingSQL Server PerformanceQuery optimizationApplication performance
103,NET C jQuery and SQL Server questionscoded on white boardSyntax to inherit one class and implement two interfaces
104,If i have one class which is implementing two interfaces and both interfaces have exact same methods then how will i get to know that this method is from particular interfacejQuery validationIf I have two textboxes having same name in different user controlsi
105, UC1 and UC2 then what will be the id of textbox after running the APPQuery optimization in SQL ServerHow to improve performance of your application
106,they give two tables table 1users ordganisation_IDOrder_id
107,                   table 2order_id order description and had primary key relation with order_idWrite query to display all the records
108,write a query to get count of users based on organization
109,Linq query syntaxhad static variable and want to use in both pages
110,NET  CAny problems faced during projects and how did you solve themWhat is a masterpagewhat is an error page
111,What is ConstructorWhat is DestructorWhat is namespace How it is usedWhat is GACWhat are the types of errorsWhat is Page directive What it doesWhat is State ManagementWhat is PostBack how to store data while posting backWhat is Code BehindWhat is AutoEventWireupWhat are the techniques used for transferring data from one page to another pageWhat is Cross JoinWhat is Inner JoinLeft JoinRight JoinWhat is Method OverloadingWhat is dllHow to handle multiple dllsHow to loop through the controls on webpageWhat is ViewStateWhat is HTTPWhat is web
112,Why angularjs why not jqueryjavascript
113, You have 2 pages and 2 diff controllers
114, you need to pass data from one page to anotherhow will you do that
115,how does one mock http config4
116,explain how will you mock your html pages and your viewsWeb api1
117,life cycle of web api
118,what is the advantage of using web api framework have you used any other dotnet framework with web api
119,web api security4
120,web api exception handling5
121,diff btwn http post and http delete6
122,MVC1
123,Why MVC why not another framework2
124,difference between abstract class and interfacewhere have you used linq in your project what is the advantage of itdisadvantage of using entity framework
125,diff between wcf rest and restful APIwhat is restful web apiwhy have you used restful web api and wheresecurity in wcf
126, what are the types of itwhat is view state where it is storedwhat is page directivewhy have you used stored procedure in sql serverpage life cycle of asp
127,Focusing on MVC WCF Web API and SQL server mainly
128,what is inheritancepolymorphismMVC routingSOA architecturehow have you implemented wcf service in your projectdiff between web service and wcfwhy SPA in angularhow have you implemented SPAdependency injectionNunit testingsource code version controladvantage of stored procedurewhy have you written stored procedure instead of writing everything in your codeTFS Agile methodologiesdisadvantage of jQuerysecurity in wcfhave you ever given any architecture design before working on any functionalityhave you ever created any documentationwhat is SSIS and SSRSasking more about what have you done in project and howwhat is route attribute in mvcsession management in mvcwhat will you do if your client will complain you that your application is running slow
129, Project role description2
130, MVC Architecture3
131, How do you handle dependency injection in AngularJS4
132, Have you used LINQ before5
133, What is promises in AngularJS6
134, What is a service in AngularJS What is a factory in AngularJS What is the difference between them7
135, Use javascript to write a function to test whether a string is a palindrome string
136, Abstract class vs Interface2
137,net framework features
138,net framework
139,Angular QuestionsHow do you rate yourself in AngularJSWhat are the filters in AngularJSWhat is routing in AngularJSWhat is deep linking in AngularJSWhat is MVCWhat is the order by filterHow does Angular
140,Module worksWhat is nginclude directiveWhat is RouteScopeWhat is AngularJS extensibleextensibilityextensible
141, page life cyclehttpwww
142, Delegate in Chttpsmsdn
143, event delegate in Chttpstackoverflow
144, What are the types of cachehttpstackoverflow
145,comquestions9728211cachetypesapplicationcache6
146,sql acid propertieshttpblog
147, Can you do multiple inheritance in Chttpstackoverflow
148, Serialization in Chttpstackoverflow
149, What are interfaceshttpstackoverflow
150, Web API
151,Dependency Injection in Angular
152,Have you used Angular 1
153,how to display duplicate records from the table
154,What is html canvas8
155,bunch c questionscan a class have multiple inheritancehow to inheritance multiplewhat is protectedwhat is protected internalwhat is base class in 
156,net all classes derived fromwhat is immutabledifference between string and stringbuildercan we have different data type in arrayhow to sort a arraywhat is access by key valueif try catch didnt execute it will reach finally Yesnocan you have multiple try and catch
157, What does an MVC model binder do2
158, Describe how you would set up the structure an AJAX and be able to handle the responses coming back from it9
159, What would you do to be able to handle errors Or a success from an AJAX call10
160, What type of security implementation do you use in your MVC projects11
161, How do you go ahead and how do you start off with a UI design and how do you take UX into consideration15
162, You have an excel spreadsheet that is going to be broken up into multiple sheets and each one of those sheets is going to represent a page
163, And the data elements that are expected on that page
164, How do you start off How do you take that and how do you start your design aspect16
165, Once you come up with your designs does anybody review them What is the process17
166, What are some of the things that you take into from a technical perspective when you are designing a front end18
167, When you are thinking about some of the containers or controllers that are going to be providing functionality what are some things you take into consideration19
168, What are some of the basic class that youd need to use to create a responsive grid22
169, What type of client side scripting have you done23
170, Left outer join for LINQ30
171, When do you choose to use master pages35
172, You can create packages of themes outside of master pages
173, When would you want to use this instead of master pages36
174, What have you done in Angular38
175, What is binding model in Angular How do you structure your project to do that39
176, If you are using Angular on top of an MVC project how do you determine what Angular based components you will be using versus MVC components
177, What version of Angular3
178,NET MVC and Angular as well4
179, How are request processed in MVC7
180, How do you implement role based authorization in MVC12
181, How do you handle errors in MVC13
182,NET Web APA14
183, Explain briefly your current application architecture
184, Explain your data flow for Angular
185, Do you use any orchestration layer in your Angular application17
186, Have you implemented any C design pattern18
187, Explain factory design pattern
188, Have you worked on LINQ21
189, Explain what is LINQ22
190, What are the variants of LINQ available23
191, What is partial view in MVC24
192, Briefly explain the layers involved in your SOA and their functionalities
193, How do Angular components interact There is a dropdown list that lists countries
194, How does the interaction for these components interact in Angular29
195, How do interceptors work in Angular32
196, If I am using a pagination directive how can I be sure that it is being used multiple times in the same page
197, What technologies did you use in your current project UI Rest API Backend Database2
198, How was data being transported from Web API to Angular JS What request did you have4
199, Did you use factory or service to connect to your Web API8
200, What tool did you use in Angular to make your Web API call I want to know the syntax
201, What is the difference between GET and POST I know that GET retrieves data and POST is uploading data
202, Even when we use POST we are retrieving data so what is the real difference For example when you simulate a GET and a POST call in Fiddler what is the difference12
203, How do you make an AJAX call synchronous14
204, What is the return type of a GET or POST call19
205, What does FirstOrDefault do in LINQ20
206, Write a LINQ query that joins two tables
207, How do you convert jQuery code to Angular code using directives25
208, How do you use Entity Framework to get data from database in a list26
209,AngularDifference between controller and serviceInitiate controller vs service  how they differentAdvantage of directivesPromise vs callbackany experience with angular2MVC concept  advantage using it
210,How MVC worksput vs patchput http verb forpost http verb forpatch  http verb forCORS  how to handle itadvantage and disadvantage with multiple indexes in table
211,how to do 2way data binding in angularjswhat is the difference between ngmodel and ngbinddifference between promise and callback in JStypes of providers in AngularJShow to do inheritance in JSwhat is closurewhat is isolation scopewhat is the issue with 1
212,x related to 2 way data bindingwhat is action filters in MVChow to do serialization in WCFdifference between IENumerable and IQuerable
213,AngularWhat is directiveHow you achieve two way databindingWhat is difference between promise and callbackWhat is the advantage of single page applicationCCan you inheritance multiple classDifference between String and String builder
214,RedirectMVCHow you achieve routingWeb APIDifference between PUT and POST
215, Web developer with very strong Asp
216,net  C SQL 2012 JavaScript Entity Framework WCF and very strong UI development using Bootstrap and AngularJs  Expert Level
217,It was a Vendor interview on Phone CallWhat is Union and Union All in SQLWhat are join in SQLWhat is Scope in AngularJsDescribe Angular Js ArchitectureHow to Integrate Bootstrap with Angular JsWhich C version youve usedWhat is two way binding in Angular JsIs ASP MVC Is two way bindingWhere to use Http
218,Get and http
219,PostHow to connect Database with AngularJsWhat is NGRepeatNgShowNGHide
220, Have you ever used thisWhat is AJAX
221,MVCWhat is routing in mvcWhat is in routing tableHow the routing worksWhat is the life cycle of each requestWhat are action filtersHow to secure the site other than the usual loginidpassword wayWhat are difference between tempdata vs viewdataWhat is viewbag how is it different from viewdataIn general why do we use design patternWhat design pattern used in the past experience Briefly explain each and case use it
222,SQLAdvantage of inline function and store procedure
223, Why do you use one over anotherWhat is SQL injection How do you prevent itWhat are different joinsIf you have 3 tables 1st one with few hundreds records 2nd one with few thousands records and 3rd one with few millions records
