,0
224,When perform joinsfilter on three tables which way is faster from smallest to largest or largest to smallestWhat is SQL profiler Brief explain past experience using it
225, What motivated you to move from Webforms to MVCQ2
226, Why did you use jQuery and AJAXQ3
227, Which approach did you use for Entity Framework Code first or database firstQ4
228, Why did you use Angular JSQ5
229, Have you used Web API Have you used Node JS Which ones betterA
230, I answered I prefer Node JS because that is what I have worked with on my project so Im more comfortable with it
231, Have you worked with NoSQL Which database in particularQ8
232, Would you be comfortable with Angular 2
233,Round 1Syntax for creating object variable in JavaScript Which tool you have used for version Controlversion you have usedexplain how will you resolve conflict on your pageRound2It was coding roundi had to create MVC application where employee name and department name is to bind todropdown based on that the list of employees had to filter and when we click on employeein employees list the detail of empolyee should be displayed in modal popup
234,In sql server i had to create 2 table employees and departmentstore proceduresRound 3IT was with Project managerthey asked me question about my resume and explained me about position
235,Managerhe asked me questions like Why you want to work with GEPWhat are your expectation from your Project manger Qualitites needed in good project manager
236,1 Web Api pipeline2 Triggers and their types and can we use select statement in triggers3 how angular js commumnicated with web api4 what is 3tier architecture5 Store procedure6 how you implement authentication and authorization in webforms7 how to implement authentication and authorization in angular js using webapi8 How does webforms communicates with database9 How many team members have you worked with10 tell me something you have worked with according to our company requirements11 difference between union and union all12 tell me about angular js project you have worked13 How to improve performance in front end in html if you have 1000 of records14 Fiddler15 Code first approach and data first approach
237,What are the differences between Web APIWCFWeb ServicesWhat are the differences between HTTP and HTTPSWhat do you expect from HTTP callIf you go into your browser and type in a http link what are the steps it went throughWhats the benefit using AngularJSWhat are the differences betweenASP
238,NETMVCWhat is the major benefit using MVCWhat is hash tableDifference between hash table and dictionary
239,Whats the differences between interface and abstractCWhen you writing store procedure what will you use temp table or table variableWhats the difference between UNION and UNION all and which one is faster
240,Difference between class and object
241,Why we consider javascript client side languageWhen we enter a site on brower what are the steps usally happenAny tools used before to test http callsWhat does a http call usually returnWhat does AJAX call returnHow you make a AJAX callWhy do we need asynchronous callIn javascript whats the difference between let and var
242,Whats the difference between promise and callbackUsed any SCSsource control system before what are they use forHow Angular binding workDifference between onewaytwoway binding and ngmodel
243,NET MVC in controller what is return type for a viewWhat does JSONresult returnWhat is the base class these result derive fromand few more questions I dont remember
244,What is the difference between interface and abstractEvery single Method declared in an Interface will have to be implemented in the subclass
245,a class that implements an interface must provide an implementation of all the methods of that interfaceabstract classes may contain state data members andor implementation methodsabstract classes can be inherited without implementing the abstract methods though such a derived class is abstract itselfCan you implement multiple interfacesA class can implement multiple Interfaces
246,If two interface have the same method signiture can you those interfaces implement in the same classif the return types are the same you can
247,What is a generic typeIn a generic type or method definitiona type parameters is a placeholder for a specific type that a client specifies when they instantiate a variable of the generic type
248,What does the T stands for in generic typearbitrary type TWhat is an extention method in LINQ queriesWhat is an ananymous type 
249,What parameter takes WHERE classhow does this where condition mapped to the collection objectWhat is a delegateDelegates are essentially function pointers but with extra multicast capabilities built in
250,So you can assign several functions to the same delegateand they will all be called in sequence when the delegate is called
251,What is an event handlerWhen events occur the application should be able to respond to it and manage it
252,NET raised at the client machine and handled at the server machine
253, Web
254,NET engine http moduls verifies and giv it to the server
255,On the client
256,Difference between Web API and WCF
257,Difference between WCF binding and basic Http binding
258,Coelsce functionDifferent joinsHow to join two tables on different servers
259,Defining the database objectWhat reporting tools did you use reporting toolsControl flow in SSRSDynamic sql
260,How to implement dynamic query
261,What are nullable typesWhat is a temptablewhat is the difference between unique and primary keyswhat is table variableThere is a query with 20 Joins
262, How do you solve the problemWhat is an interfaceWhat is a class and module in CHow to pass data between cotrollers and viewsHow to find duplicates in SQLHow do you create modal pop up with JS
263,You have a DB and pass data from dB to the client through WCF
264, The data coming from the client side is corrupted
265,Questions about how to debug front end backendwhat are the html extenders in MVCwhat do you do to learnget familiar with an application
266,null vs undefined vs  which is fasterRest verbs http requestDescribe two programming paradigms in JSWhat patterns are used in JSDifference between prototypical and classic inheritance in JSDescribe functional programmingPros and Cons between functional programming and OOP in JS
267,What is asynchrouns programming Why is that importantPros and cons between microservice and model for restful applications
268,What are optimization strategiesHow do you do unit testing for a function returning Hello World in Jasmine
269,ArrayArraylistHashtablePerformance differences between these threeSealed classTDDUnit Testing
270,Struct vs class
271,Abstract vs interface In common they enforce certain hierarchies for all the sub classes
272,Which classes are the delegates derived from System
273,What are partial classes10
274,How to implement singleton design pattern
275, design pattern where did you use2
276,LINQ did you use conventional one or lambda
277,How do you provide authentication and security in WCFkendogrid performs paging client side or server side what is the specificrequrement in your project to use kendo grid and why you implemented paging which collection is fasterwhy bootstrap even if we can achieve it by css why not CSShow do you return data in xml from databasecross apply and outer apply in sql serverhow do you query xml using linqcan you query html using linqWebApi securitywhen do you generate token and how furthur reuests and responses will use token and how do you consume apis using angularjs and mvcajaxHow do you provide security if i directly call web api from browsermvc actionresult reurn typeshow do you make mvc asynchronous calls other than ajaxajax helpersMVC request life cycleIQueryable vs IEnumerable
278,How do you provide authentication and security in WCFkendogrid performs paging client side or server side what is the specificrequrement in your project to use kendo grid and why you implemented paging which collection is fasterwhy bootstrap even if we can achieve it by css why not CSShow do you return data in xml from databasecross apply and outer apply in sql serverhow do you query xml using linqcan you query html using linqWebApi securitywhen do you generate token and how furthur reuests and responses will use token and how do you consume apis using angularjs and mvcajaxHow do you provide security if i directly call web api from browsermvc actionresult reurn typeshow do you make mvc asynchronous calls other than ajaxajax helpersMVC request life cycleIQueryable vs IEnumerable
279,Extension methods And code for that using this keyword and staticPartial classesGeneric collections and methods for stackVar and dynamic keywordAutomatic propertiesreadonly vs constIQueryable vs IEnumerabledefered exeution and immediate executionsome linq queries both query syntax and method syntaxlambda expressionlazy loading and eager loadingrouting in web apiauthentication and authorizationwhat encryption technique you used to store password in databasedata annotationsexception handling and what kind of exception template or error message did you use to handle exceptions in web apihow do you debug webapi using fiddlercontent type in content negotiationDesign patternsbridge pattern
280,Mostly Project Related questions and on following topics1
281, Web API2
282, Features of MVC 55
283, Features of SQL Server 20146
284,Screening Interview by client
285,How to implement data entity modelExplain flow of data using ADO
286,netHow to optimize your data baseHow did you make connection to your database without using entityHave you ever worked with huge amount of data records and how did you handle it
287,ready functionsmodel bindershow to handle two submit buttons in one form in mvccode refactoringunit testingWhat was the mistake that you did in your projectwhat did you develop in your project that you can say proudlyRoutings in mvc
288,Features of MVC that you find most usefulSQL JoinsQueries Types ExamplesPassing data from Controller to controllerDelegatesAngular RoutingAngular DirectivesCustom DirectivesWhat is it Why to use SyntaxMVC FiltersException HandlingSession Management in MVCSession Management in Web Forms Token Based Authentication Contracts in WCF services Fault Contract in WCFHow to use
289,Describe OOPWhat different between abstract vs interfaceWhat is differencebetween value vs refWhat is the difference between string vs string builderWhat is difference between API and MVCWhat is Protect access modifierWhat is internal access modifierWhat is different between overloading and overridingis it possible to override a static method in derived classHow to you prevent a class from being inheritWhat is CursorWhat is difference between delete and truncatewhat is difference between stored procedure and functionHow do you improve SQL executionDo you know what is execution Plan
290, difference between hash table and dictionary2
291,which part of a application do you enjoy coding is it UI or back end
292,aunthentication and authorization in MVC5
293,Password encryption in database6
294,3rd normalization in SQl database design7
295, what are the unit test frameworks that you are familiar with11
296,how often do you run the application and unit test12
297, have gone through the design documents of your fellow developer when he is not around
298, when does the QA team test your application
299,SQLWhat is a stored procedureWhy would you use temp dataHow would you check for error in store procedureWhere and when would you use triggerJQueryWhat is Cross Site ScriptingWhat is SQL InjectionWhat have you work with in JQuery
300,1 He asked me about my Background2Html 5 features3Responsive Web Design4Basic Question about Object Oriented inheritanceobjectEncapsulation5how to make table border curved6token Based Authentication7Action Filters8what is RestFull Application
301,How would you represent Animal Kingdom in a Class structure Dictionary Vs Generic Lists and Hash tablesPerformance Memory Usage Efficiency etc Features of C that you find most useful
302, Features of MVC that you find most useful
303, Testing in MVCWhy How Documentation work for the project Interaction with the testing team
304,Web Api Web ServicesHow and where in the projectREST vs SOAPWhy MVCWhy AngularSecurity in the project
305,1 Introduce yourself2 Tell me about latest projectSQL1 Joins and different kinds of joins2 Index and different kinds of index3 stored procedure  where you used it in your project4 triggers5 viewsOther technical questions1 Closure2 Design pattern3 Dependency injectionExplain all the projects you have worked on
306,Do you face any performance issues in previous projectsSQLHow do increase the performance of a viewIn Jquery How do you select the particular Element from DOMUse of Repository patternWhat are clusterINDEXdifference between Temptable temp variable and ViewCan you call the stored procedure and Userdefined Functions in select statementsDo you ever used third party tools
307,Description of technologies you usedTriggers on entity frameworkIn Entity Framework what is pluralizedExtension of Entity FrameworkHow do you get store procedure into Entity FrameworkThird Party controls for front EndWhat is RazorHave you worked on Code first approach
308,Asked some questions based on projects index in SQL clustered nonclustered what is interface difference between reference type and value type difference between data adapter and reader whatwherehow do you use linq design pattern singleton and factory string gt i talked about it and also mention string builderthere are more cant remember them
309,Introduce yourselfDifference Between Class and StructureHow do you test the store procedurewhat are the triggers you used in your projectsValue type VS Reference typewhy we use LINQwhat is IQueryablenamespace for using IEnumerableDebug a page which is not loading the particular webgrid
310,What are views and indexes and different types of indexes and how you implemented itHow do you check the checkbox is checked using angularJsHow do you make sure that all the corresponding class objects are loaded in the application if not how do we do that manuallyWhat are triggers for what action in database you used itWhat is cross join  Have you ever implemented Ref an Out objects in CWhat are extension methodsWhat are enumerable types in CWhat are filtersWhat are design patterns and how you used in projectWhat is dependency injectionHow can we retrievemultiple tables from database
311,ltdiv classtitlegtltpgtISF Applications DevelopmentltpgtltdivgtWhat are the different ways could you make the ISF Applications Development text appear with a yellow background Give as many as you know
312, Write a function that calculates the sales tax rate in  given the sticker price and actual amount paid
313, Write a function for validating an email address that meets the following minimum requirements at least 10 characters 1 lowercase letter 1 uppercase letter 1 number and no sequential lowercase letters
314,net application to MVC 6
315, How will you improve the performance of the application
316,How does an angular application work
317,1What is Type Script2how do you consume rest API in angular3what is scope in angular4how do you manage request in rest API5Explain MVC6Role based securities7explain about your last project
318, find all element p tags on page which they dont have any classstyling3
319, Given the following html snippet     96    Normal  0        10   0  2    false  false  false    ENUS  ZHCN  XNONE                                                                                                                                                                                                                                                                                                                                                                                                                                                                                                                                                                                                                                                                                                                                                                                                                                                                                     Style Definitions table
320,0ptltdiv classtitlegt ltpgtISF Applications DevelopmentltpgtltdivgtWhat are the different ways could you make the ISF ApplicationsDevelopment text appear with a yellow background Give as many as you know
321,addClass assume we havethe css class yellowClass for the p tag p
322, ltp class yellowClassgtISF ApplicationsDevelopmentltpgtProblem 2 Write a function that calculates thesales tax rate in  given the sticker price and actual amount paid
323,By considering the terms in the Fibonacci sequence whose values do notexceed four million write a function that will find the sum of the evenvaluedterms
324,1Current Project2 Triggers in SQL3OOPS Concept4SSIS Experience5Explain what is SSIS package6Explain what variables in SSIS and what are the types of variables in SSIS7Role based Authentication
325,Whats exception handlerHow to handle http request How to do custom Routing in MVC or AngularJS
326, Lock function9
327, Routing Virtual Routing Routing Manager in MVC11
328, WCF service create consume deploy
329,Why cdesign patterns and explanationArchitecturehow did you implement Code first approachdesign paradigmTDDLINQJasminemultithreadingdependency injection
330,How to add new row into the table using code first approachinterface and abstract classtemp table and temp variableAction filtersException handlingsingleton session management techniques in MVCpartial view and view differencesHTML helpersMVC request flow
331,Current Project Role Responsibilities and technologies useda
332,Worked as both front end and back end devb
333,Used Angular JSCSSHTML5 JavaScript C MVC2
334,Angular JSa
335,C MVC LINQSQL Servera
336,MVC Page life cycleb
337,LINQ Advantages over Ado
338,s1 fontkerning noneQuestion 1 Write a function to find the longest common prefix string amongst an array of strings
339,substring0i                                   return prefix    else     return strs0     Question 2 given trade table how do you retrieve newest versiontblTrade
340, Implement Abstract class and interface inherit the interface to Abstract class and implement the methodsJavascript4
341, what is Secured API8
342, How did you consume the Web Api in Angularjs11
343, Joins in SQL12
344,NETMVCa
345,NETMVClifecycle diff Action result partial view
346,What are the frameworks you used todo for client side and server side
347,Interviewer 1Tell me about yourselfWalk me through your recent projectWhat enhancements did you make on this projectWhat was the difficult thing you faced during this projectwhat technology have you learntby yourselfSQLDifferencebtw truncate and delete which makes identity to resetQuestions on indexesIf you have one stored procedure then how do u call other stored procedure while executing ithow to test your stored procedurehow do you get tocount the columns if you donthave a primary key in it but just first nameand second name I told wecan use rank column such as using row_numberwhat is a cross join and where did use itdid you work on getting XML data in sql  I said Inever tried it but given a chance i would like to try it
348,MVC what version of MVCyou usedwhat is action resulttell me about qualitiesof MVCwhat is dependencyinjectionwhats new in mvc5what design patterns you knowwhat are extensionmethodswhat is routingdiff btw view and a partial view Have you used the partial view in your application and whereCtell me what you know about interfacesInterviewer 2Tell me about yourselfhow good you understand financial terms as it is a financial companywhat table you used in your projecttold me to write a query  we have customertable and another tablehow dou get top 5 values by joining those tableswhat is the default typein joinsalso told me to write a logic on getting profit or lossdepending on my project tablescdifference between value and reference typewhich type is a stringand whywhat is polymorphismInterviewer 3gone through about myselfwhat are html helpersdiffencebetween dataset and datareaderwhat is the difference between webform state management and mvcstate managementgiven a query on sqlcase and what it returnsSELECT ID WHEN NullNull THEN yes  FROM EMPLOYEEMy answer I identify as isNULL which was correctAnother querySelect DEPARTMENT sumSALARY Total_Salary from employee group by DEPARTMENT having sumSALARY gt800000My answer we should give group by DepartmentHave you worked on query optimizationHave you worked on support calls ssrsIf you are alone in the office who do u approach first if you get any support call
349,Interviewer 1Tell me about yourselfWalk me through your recent projectWhat enhancements did you make on this projectWhat was the difficult thing you faced during this projectwhat technology have you learntby yourselfSQLDifferencebtw truncate and delete which makes identity to resetQuestions on indexesIf you have one stored procedure then how do u call other stored procedure while executing ithow to test your stored procedurehow do you get tocount the columns if you donthave a primary key in it but just first nameand second name I told wecan use rank column such as using row_numberwhat is a cross join and where did use itdid you work on getting XML data in sql  I said Inever tried it but given a chance i would like to try it
350,MVC what version of MVCyou usedwhat is action resulttell me about qualitiesof MVCwhat is dependencyinjectionwhats new in mvc5what design patterns you knowwhat are extensionmethodswhat is routingdiff btw view and a partial view Have you used the partial view in your application and whereCtell me what you know about interfacesInterviewer 2Tell me about yourselfhow good you understand financial terms as it is a financial companywhat table you used in your projecttold me to write a query  we have customertable and another tablehow dou get top 5 values by joining those tableswhat is the default typein joinsalso told me to write a logic on getting profit or lossdepending on my project tablescdifference between value and reference typewhich type is a stringand whywhat is polymorphismInterviewer 3gone through about myselfwhat are html helpersdiffencebetween dataset and datareaderwhat is the difference between webform state management and mvcstate managementgiven a query on sqlcase and what it returnsSELECT ID WHEN NullNull THEN yes  FROM EMPLOYEEMy answer I identify as isNULL which was correctAnother querySelect DEPARTMENT sumSALARY Total_Salary from employee group by DEPARTMENT having sumSALARY gt800000My answer we should give group by DepartmentHave you worked on query optimizationHave you worked on support calls ssrsIf you are alone in the office who do u approach first if you get any support call
351,Describe the similarities and differences between an abstract class and an interfaceWhat collection can be used to store elements of different typesHow to design the Node type of any complex data structureHow to determine the type of an unknown object at run timeGiven a table named Employee and the following table schemaEmpId EmpName Month BonusWrite a query that returns those employees who received a bonus in June onlyWhat happens when a Valuetyped object is passed as argument to a method What when it is a ReferenceTypeSay that you have a database query that runs smoothly
352, Then the next day the same query is running very slow
353, What problem in the database could this be an indication of
354,What is WebAPIwhat is const and readonly in cAgile Scrumrole of modules in angular2databinding in angular2what is variables access modifier by default in typescriptdependency injection in angular2unit testing in angular2how to test backend api using angular2
355,They started asking me about my recent project why angularjs framework for testing dependency injection framework for dependency injection what are features of restful services what are rest principles why entity framework pros and cons how i was interacting with the team tool used for the same what would be your first approach when you hear any issue what was the biggest challenge faced during previous project stored procedure with entity framework what are triggers what framework used for logging why and what services used in angularjs
356,Tell me about yourselfsql what are triggers diff btwn truncate and delete scenario based diff btwn function and stored procedure
357,what is delegate dependency injection multicast delegate how to implement token based security why entity framework how do you make a function asynchronous diff btwnasync and await keywords why restapiwhy angularjsGiven two sqlqueries to write
358,Shown a function and asked to make it asynchronous
359,introduce yourselfrecent project how big was the team how you use to coordinate with each other what tool usedhow did you learn angularjswhy angularjstesting framework usedwhat is dependency injectionwhat is restful servicesdiff between readonlyand const variableswhat is heapwhat is garbage collectorhow garbage collector workshow do you implement garbage collector externallyhow dependency injection works in angularjs how do you call itdid you participate in codepeer reviews
360,how big is your teamwhat is the velocity of your teamare you comfortable in working frontend or fullstackwhywhat are the challenges you faced in your projectHow you solve themwhat kind of difference you found in Indian work environment and in USdetails of the recent projectis your recent project livecan we access your recent applicationhow will you improve efficiency in your projectwhat is your day to day activity Any difficulties
